<?xml version="1.0" encoding="UTF-8"?>
<!ELEMENT bookstore (book)+>
<!ELEMENT book (title,isbn,autor,year,size,price)>
<!ELEMENT title (#PCDATA)>
<!ELEMENT isbn (#PCDATA)>
<!ELEMENT autor (#PCDATA)>
<!ELEMENT year (#PCDATA)>
<!ELEMENT size (#PCDATA)>
<!ELEMENT price (#PCDATA)>